{
  "schemaVersion": 1,
  "entityType": "mod",
  "platform": "NexusMods",
  "id": "1915",
  "name": {
    "zh-CN": "Content Patcher (内容加载器)",
    "source": "Content Patcher"
  },
  "description": {
    "zh-CN": "加载可改变游戏数据、地图和图像的内容包，无需替换XNB文件。",
    "source": "Loads content packs that change the game's data, images, and maps without replacing XNB files."
  },
  "meta": {
    "contributor": "mc_shengxia",
    "sourceUrl": "https://www.nexusmods.com/stardewvalley/mods/1915",
    "updatedAt": "2026-03-13T04:46:27.690Z"
  },
  "dependencies": [],
  "hardConflicts": [],
  "functionalOverlaps": []
}
